<?xml version="1.0" encoding="UTF-8"?>
<tns:student xmlns:tns="http://www.example.org/student" xmlns:xsi="http://www.w3.org/2001/XMLSchema-instance" xsi:schemaLocation="http://www.example.org/student student.xsd ">
  <tns:ssn>tns:ssn</tns:ssn>
  <tns:institution>tns:institution</tns:institution>
  <tns:age>0</tns:age>
  <tns:email>tns:email</tns:email>
  <tns:name>
    <tns:firstname>tns:firstname</tns:firstname>
    <tns:lastname>tns:lastname</tns:lastname>
  </tns:name>
</tns:student>
